{
  "$schema": "https://json-schema.org/draft/2020-12/schema",
  "$id": "https://github.com/pereirawolf/ki-lead/evaluation/faelle/fall.schema.json",
  "title": "Bewertungsfall KI-LEAD",
  "type": "object",
  "required": ["format", "id", "titel", "stand", "auftrag", "material", "erwartungen"],
  "additionalProperties": false,
  "dependentRequired": { "variante_von": ["abwandlung"], "abwandlung": ["variante_von"] },
  "properties": {
    "format": { "const": "ki-lead-evaluationsfall/1" },
    "id": { "type": "string", "pattern": "^[a-z0-9]+(-[a-z0-9]+)*$" },
    "titel": { "type": "string", "minLength": 1 },
    "stand": { "type": "string", "format": "date" },
    "fiktiv": { "type": "boolean", "description": "true, wenn Auftrag und Material vollständig erfunden sind" },
    "variante_von": { "type": "string", "pattern": "^[a-z0-9]+(-[a-z0-9]+)*$", "description": "ID des Ausgangsfalls, wenn dieser Fall eine gezielte Abwandlung ist" },
    "abwandlung": { "type": "string", "minLength": 1, "description": "Was gegenüber dem Ausgangsfall geändert wurde, möglichst genau eine Stellgröße" },
    "auftrag": {
      "type": "object",
      "required": ["sachverhalt"],
      "additionalProperties": false,
      "properties": {
        "sachverhalt": { "type": "string", "minLength": 1 },
        "stichworte": { "type": "string" },
        "urls": { "type": "array", "items": { "type": "string", "format": "uri" } },
        "stichtag": { "type": "string", "format": "date" },
        "meldezeitpunkt": { "type": "string", "pattern": "^\\d{4}-\\d{2}-\\d{2}T\\d{2}:\\d{2}$" },
        "prueffrage": { "type": "string" },
        "websuche": { "type": "boolean" },
        "verdichtung": { "type": "boolean", "description": "Eingangsmeldungen verdichten statt neu zu erfassen" },
        "kurzfassung": {
          "type": "boolean",
          "description": "Management Summary aus einer festen, fertigen Meldung (Material mit Rolle „meldung“); S1 und S2 entfallen"
        }
      }
    },
    "material": {
      "type": "array",
      "items": {
        "type": "object",
        "additionalProperties": false,
        "oneOf": [{ "required": ["datei"] }, { "required": ["extern", "sha256"] }],
        "properties": {
          "datei": { "type": "string", "description": "Pfad im Repository (nur fiktive oder freie Inhalte)", "pattern": "^(?!/)(?!.*\\.\\.)" },
          "extern": { "type": "string", "description": "Herkunft außerhalb des Repositorys, z. B. URL; Inhalt nicht eingecheckt" },
          "sha256": { "type": "string", "pattern": "^[0-9a-f]{64}$" },
          "rolle": { "enum": ["eingang", "material", "vormeldung", "meldung"] },
          "hinweis": { "type": "string" }
        }
      }
    },
    "erwartungen": {
      "type": "object",
      "additionalProperties": false,
      "required": ["muss"],
      "properties": {
        "muss": {
          "type": "array",
          "minItems": 1,
          "items": { "type": "string", "minLength": 1 },
          "description": "Aussagen, die ein brauchbarer Entwurf enthalten muss"
        },
        "darf_nicht": { "type": "array", "items": { "type": "string", "minLength": 1 }, "description": "Bekannte Fehlannahmen oder unzulässige Aussagen" },
        "t0": { "type": "string", "pattern": "^\\d{4}-\\d{2}-\\d{2}T\\d{2}:\\d{2}$" },
        "referenzraum": { "type": "string" },
        "ereignisarten": { "type": "array", "items": { "type": "string" } },
        "radar": {
          "type": "object",
          "description": "Erwartete Radarwerte des einzigen erwarteten Sachverhalts, je Achse als fachlich vertretbare Spanne min–max oder als offen, jeweils mit Grund; eine fehlende Achse bedeutet keine Erwartung",
          "minProperties": 1,
          "additionalProperties": false,
          "patternProperties": {
            "^d[1-8]$": {
              "type": "object",
              "additionalProperties": false,
              "required": ["grund"],
              "oneOf": [{ "required": ["offen"] }, { "required": ["min", "max"] }],
              "properties": {
                "offen": { "const": true },
                "min": { "type": "integer", "minimum": 0, "maximum": 6 },
                "max": { "type": "integer", "minimum": 0, "maximum": 6 },
                "grund": { "type": "string", "minLength": 1 }
              }
            }
          }
        }
      }
    }
  }
}
