{
  "format": "ki-lead-evaluationsfall/1",
  "id": "sop-logistik-niedrigwasser",
  "titel": "Niedrigwasser und reale Ersatztransportleistung (FIKTIV)",
  "stand": "2026-10-21",
  "fiktiv": true,
  "auftrag": {
    "sachverhalt": "Niedrigwasser und reale Ersatztransportleistung",
    "stichworte": "B05, C13, C12",
    "stichtag": "2026-10-21",
    "meldezeitpunkt": "2026-10-21T12:00",
    "prueffrage": "Nur das beigefügte Übungsmaterial auswerten. Relevanz für den Bevölkerungsschutz in Deutschland, belegte Wirkungen und offene Fragen getrennt darstellen. Keine Live-Recherche und keine erfundenen Ergänzungen.",
    "websuche": false,
    "verdichtung": false
  },
  "material": [
    {
      "datei": "evaluation/material/sop-logistik-niedrigwasser.md",
      "rolle": "material",
      "hinweis": "Vollständig erfundene Übungsnachrichten; Rollen und Zeitstände stehen im Text."
    }
  ],
  "erwartungen": {
    "muss": [
      "Hydrologischen Befund von belegter Transportleistung und Empfängerreichweite trennen.",
      "Planung nicht als zugesagte oder wirksame Deckung rechnen.",
      "Alle urteilsprägenden Aussagen sind auf tatsächlich vorliegendes Übungsmaterial zurückführbar; offene Achsen werden begründet."
    ],
    "darf_nicht": [
      "Eine allgemeine Verkehrsblockade oder vollständige Nachschubsicherung behaupten.",
      "Eine aktuelle Webprüfung, fremde Quelleninhalte, reale Alarmierungen oder zusätzliche bestätigte Zahlen erfinden."
    ],
    "t0": "2026-10-21T12:00",
    "referenzraum": "Bund",
    "ereignisarten": [
      "Extremhitze / Dürre"
    ]
  }
}
