{
  "format": "ki-lead-evaluationsfall/1",
  "id": "sop-vulkanasche-transport",
  "titel": "Vulkanasche-Prognose und kritische Arzneimittellieferung (FIKTIV)",
  "stand": "2026-10-21",
  "fiktiv": true,
  "auftrag": {
    "sachverhalt": "Vulkanasche-Prognose und kritische Arzneimittellieferung",
    "stichworte": "B17, C04, C13, C10",
    "stichtag": "2026-10-21",
    "meldezeitpunkt": "2026-10-21T12:00",
    "prueffrage": "Nur das beigefügte Übungsmaterial auswerten. Relevanz für den Bevölkerungsschutz in Deutschland, belegte Wirkungen und offene Fragen getrennt darstellen. Keine Live-Recherche und keine erfundenen Ergänzungen.",
    "websuche": false,
    "verdichtung": false
  },
  "material": [
    {
      "datei": "evaluation/material/sop-vulkanasche-transport.md",
      "rolle": "material",
      "hinweis": "Vollständig erfundene Übungsnachrichten; Rollen und Zeitstände stehen im Text."
    }
  ],
  "erwartungen": {
    "muss": [
      "Luftraumprognose, konkrete Transportmaßnahme und derzeit gedeckten klinischen Bedarf trennen.",
      "Zeitfenster der Ersatzlieferung mit Bestand vergleichen.",
      "Alle urteilsprägenden Aussagen sind auf tatsächlich vorliegendes Übungsmaterial zurückführbar; offene Achsen werden begründet."
    ],
    "darf_nicht": [
      "Boden-Kontamination, Erdbeben in Deutschland oder eingetretenen Arzneimittelausfall behaupten.",
      "Eine aktuelle Webprüfung, fremde Quelleninhalte, reale Alarmierungen oder zusätzliche bestätigte Zahlen erfinden."
    ],
    "t0": "2026-10-21T12:00",
    "referenzraum": "Bund",
    "ereignisarten": [
      "Sonstiges"
    ]
  }
}
