{
  "format": "ki-lead-evaluationsfall/1",
  "id": "sop-grossunfall-transportkette",
  "titel": "Großunfall mit Rettungs- und Transportfolge (FIKTIV)",
  "stand": "2026-10-21",
  "fiktiv": true,
  "auftrag": {
    "sachverhalt": "Großunfall mit Rettungs- und Transportfolge",
    "stichworte": "B17, C05, C09, C13",
    "stichtag": "2026-10-21",
    "meldezeitpunkt": "2026-10-21T12:00",
    "prueffrage": "Nur das beigefügte Übungsmaterial auswerten. Relevanz für den Bevölkerungsschutz in Deutschland, belegte Wirkungen und offene Fragen getrennt darstellen. Keine Live-Recherche und keine erfundenen Ergänzungen.",
    "websuche": false,
    "verdichtung": false
  },
  "material": [
    {
      "datei": "evaluation/material/sop-grossunfall-transportkette.md",
      "rolle": "material",
      "hinweis": "Vollständig erfundene Übungsnachrichten; Rollen und Zeitstände stehen im Text."
    }
  ],
  "erwartungen": {
    "muss": [
      "Verletzte, Geborgene und Vermisste ohne Addition überschneidender Gruppen darstellen.",
      "Vermissten keine Sichtungskategorie zuordnen.",
      "Brückensperre und klinische Aufnahmefähigkeit getrennt bewerten.",
      "Alle urteilsprägenden Aussagen sind auf tatsächlich vorliegendes Übungsmaterial zurückführbar; offene Achsen werden begründet."
    ],
    "darf_nicht": [
      "Vermisste als Tote oder eine feste MANV-Stufe ohne Fachbeleg angeben.",
      "Eine aktuelle Webprüfung, fremde Quelleninhalte, reale Alarmierungen oder zusätzliche bestätigte Zahlen erfinden."
    ],
    "t0": "2026-10-21T12:00",
    "referenzraum": "Bund",
    "ereignisarten": [
      "Sonstiges"
    ]
  }
}
