{
  "format": "ki-lead-evaluationsfall/1",
  "id": "sop-hochwasser-ostsee",
  "titel": "Ostsee-Wasserstand ohne Tideannahme (FIKTIV)",
  "stand": "2026-10-21",
  "fiktiv": true,
  "auftrag": {
    "sachverhalt": "Ostsee-Wasserstand ohne Tideannahme",
    "stichworte": "B02",
    "stichtag": "2026-10-21",
    "meldezeitpunkt": "2026-10-21T12:00",
    "prueffrage": "Nur das beigefügte Übungsmaterial auswerten. Relevanz für den Bevölkerungsschutz in Deutschland, belegte Wirkungen und offene Fragen getrennt darstellen. Keine Live-Recherche und keine erfundenen Ergänzungen.",
    "websuche": false,
    "verdichtung": false
  },
  "material": [
    {
      "datei": "evaluation/material/sop-hochwasser-ostsee.md",
      "rolle": "material",
      "hinweis": "Vollständig erfundene Übungsnachrichten; Rollen und Zeitstände stehen im Text."
    }
  ],
  "erwartungen": {
    "muss": [
      "NHN-Bandbreite, Bezugszeit und Vorhersagequelle erhalten.",
      "Medienwert mit ungeklärtem Bezug nicht direkt vergleichen.",
      "Maximalzeitraum ohne erfundenen Tidezeitpunkt darstellen.",
      "Alle urteilsprägenden Aussagen sind auf tatsächlich vorliegendes Übungsmaterial zurückführbar; offene Achsen werden begründet."
    ],
    "darf_nicht": [
      "Pegelnull und NHN gleichsetzen.",
      "Eine sichere genaue Scheitelhöhe oder Tidezeit erfinden.",
      "Eine aktuelle Webprüfung, fremde Quelleninhalte, reale Alarmierungen oder zusätzliche bestätigte Zahlen erfinden."
    ],
    "t0": "2026-10-21T12:00",
    "referenzraum": "Bund",
    "ereignisarten": [
      "Hochwasser / Überschwemmung"
    ]
  }
}
