{
  "format": "ki-lead-evaluationsfall/1",
  "id": "orkantief-ilka-verdichtung",
  "titel": "Verdichtung der sechs Ländermeldungen zum Orkantief „Ilka“ (FIKTIV)",
  "stand": "2026-10-25",
  "fiktiv": true,
  "auftrag": {
    "sachverhalt": "Verdichtung der Ländermeldungen zu den Sturmfolgen des Orkantiefs „Ilka“ für die Redaktionskonferenz der Koordinierungsstelle",
    "stichworte": "Sturm, Stromausfall, KRITIS, Notstrom",
    "stichtag": "2026-10-14",
    "meldezeitpunkt": "2026-10-14T14:00",
    "websuche": false,
    "verdichtung": true
  },
  "material": [
    { "datei": "profile/lead-beispiel/beispiele/orkantief-ilka/LEAD-Meldung_HE_2026-10-14T10-15_FIKTIV_Orkantief-Ilka.json", "rolle": "eingang" },
    { "datei": "profile/lead-beispiel/beispiele/orkantief-ilka/LEAD-Meldung_NI_2026-10-14T09-45_FIKTIV_Orkantief-Ilka.json", "rolle": "eingang" },
    { "datei": "profile/lead-beispiel/beispiele/orkantief-ilka/LEAD-Meldung_NW_2026-10-14T10-00_FIKTIV_Orkantief-Ilka.json", "rolle": "eingang" },
    { "datei": "profile/lead-beispiel/beispiele/orkantief-ilka/LEAD-Meldung_RP_2026-10-14T09-30_FIKTIV_Orkantief-Ilka.json", "rolle": "eingang" },
    { "datei": "profile/lead-beispiel/beispiele/orkantief-ilka/LEAD-Meldung_ST_2026-10-14T11-00_FIKTIV_Orkantief-Ilka.json", "rolle": "eingang" },
    { "datei": "profile/lead-beispiel/beispiele/orkantief-ilka/LEAD-Meldung_TH_2026-10-14T10-30_FIKTIV_Orkantief-Ilka.json", "rolle": "eingang" }
  ],
  "erwartungen": {
    "muss": [
      "Alle sechs Ländermeldungen (HE, NI, NW, RP, ST, TH) sind als Eingänge mit eigenem A-Eintrag in den Quellen berücksichtigt",
      "Die Zahl der weiterhin Stromlosen wird je Land mit Einheit und Datenstand angegeben; zusammengeführt wird sie nur, wenn die Zählregeln der Arbeitsanweisung Verdichtung (Regeln 3 und 4) erfüllt sind, sonst wird die Nichtaggregation begründet",
      "Das Ende von Notstrompuffern vor der Wiederversorgung wird als zeitkritischer Punkt benannt",
      "Abweichende Bewertungen oder Tendenzen der Länder werden benannt statt geglättet"
    ],
    "darf_nicht": ["Angaben, die in keiner Ländermeldung stehen, ohne Kennzeichnung als Annahme", "Eine eigene Websuche oder Quellen außerhalb der Eingänge"],
    "t0": "2026-10-14T14:00",
    "referenzraum": "Bund",
    "ereignisarten": ["Unwetter / Sturm", "Stromausfall / Blackout", "KRITIS-Ausfall"]
  }
}
