{
  "format": "ki-lead-evaluationsfall/1",
  "id": "sop-gas-geschuetzt",
  "titel": "Geschützter Kunde ohne technische Versorgungsgarantie (FIKTIV)",
  "stand": "2026-10-21",
  "fiktiv": true,
  "auftrag": {
    "sachverhalt": "Geschützter Kunde ohne technische Versorgungsgarantie",
    "stichworte": "B09, C12",
    "stichtag": "2026-10-21",
    "meldezeitpunkt": "2026-10-21T12:00",
    "prueffrage": "Nur das beigefügte Übungsmaterial auswerten. Relevanz für den Bevölkerungsschutz in Deutschland, belegte Wirkungen und offene Fragen getrennt darstellen. Keine Live-Recherche und keine erfundenen Ergänzungen.",
    "websuche": false,
    "verdichtung": false
  },
  "material": [
    {
      "datei": "evaluation/material/sop-gas-geschuetzt.md",
      "rolle": "material",
      "hinweis": "Vollständig erfundene Übungsnachrichten; Rollen und Zeitstände stehen im Text."
    }
  ],
  "erwartungen": {
    "muss": [
      "Gesetzliche Schutzzuordnung und tatsächliche Wärmeversorgung auseinanderhalten.",
      "Wärmefunktion und betroffenen Gasanteil im belegten Umfang beschreiben.",
      "Eine alte Bescheinigung nicht als geschützte-Kunden-Zulassung übernehmen.",
      "Alle urteilsprägenden Aussagen sind auf tatsächlich vorliegendes Übungsmaterial zurückführbar; offene Achsen werden begründet."
    ],
    "darf_nicht": [
      "Geschützten Kunden eine garantierte unterbrechungsfreie Wärmeversorgung zuschreiben.",
      "Selbst eine Schutzkategorie zuerkennen oder Abschaltreihenfolge festlegen.",
      "Eine aktuelle Webprüfung, fremde Quelleninhalte, reale Alarmierungen oder zusätzliche bestätigte Zahlen erfinden."
    ],
    "t0": "2026-10-21T12:00",
    "referenzraum": "Bund",
    "ereignisarten": [
      "Gasversorgungsengpass"
    ]
  }
}
