{
  "format": "ki-lead-evaluationsfall/1",
  "id": "sop-infektion-ausland",
  "titel": "Auslandsinfektion ohne belegte deutsche Direktbetroffenheit (FIKTIV)",
  "stand": "2026-10-21",
  "fiktiv": true,
  "auftrag": {
    "sachverhalt": "Auslandsinfektion ohne belegte deutsche Direktbetroffenheit",
    "stichworte": "B11, C07",
    "stichtag": "2026-10-21",
    "meldezeitpunkt": "2026-10-21T12:00",
    "prueffrage": "Nur das beigefügte Übungsmaterial auswerten. Relevanz für den Bevölkerungsschutz in Deutschland, belegte Wirkungen und offene Fragen getrennt darstellen. Keine Live-Recherche und keine erfundenen Ergänzungen.",
    "websuche": false,
    "verdichtung": false
  },
  "material": [
    {
      "datei": "evaluation/material/sop-infektion-ausland.md",
      "rolle": "material",
      "hinweis": "Vollständig erfundene Übungsnachrichten; Rollen und Zeitstände stehen im Text."
    }
  ],
  "erwartungen": {
    "muss": [
      "Ausländische Fallzahl nicht auf deutsche D2 übertragen.",
      "Den deutschen Nullbefund nur mit definierter Erhebung und Zeitraum verwenden.",
      "Deutschen Beobachtungs-/Abstimmungsbedarf von bereits eingetretener Wirkung trennen.",
      "Alle urteilsprägenden Aussagen sind auf tatsächlich vorliegendes Übungsmaterial zurückführbar; offene Achsen werden begründet."
    ],
    "darf_nicht": [
      "500 direkt Betroffene in Deutschland oder automatische erhebliche deutsche Lage behaupten.",
      "Eine aktuelle Webprüfung, fremde Quelleninhalte, reale Alarmierungen oder zusätzliche bestätigte Zahlen erfinden."
    ],
    "t0": "2026-10-21T12:00",
    "referenzraum": "Bund",
    "ereignisarten": [
      "Gesundheitliche Lage / Epidemie"
    ]
  }
}
