{
  "format": "ki-lead-evaluationsfall/1",
  "id": "sop-chemie-ohne-aussenfreisetzung",
  "titel": "Industriebrand mit überörtlichem Rettungsbedarf (FIKTIV)",
  "stand": "2026-10-21",
  "fiktiv": true,
  "auftrag": {
    "sachverhalt": "Industriebrand mit überörtlichem Rettungsbedarf",
    "stichworte": "B07, C09",
    "stichtag": "2026-10-21",
    "meldezeitpunkt": "2026-10-21T12:00",
    "prueffrage": "Nur das beigefügte Übungsmaterial auswerten. Relevanz für den Bevölkerungsschutz in Deutschland, belegte Wirkungen und offene Fragen getrennt darstellen. Keine Live-Recherche und keine erfundenen Ergänzungen.",
    "websuche": false,
    "verdichtung": false
  },
  "material": [
    {
      "datei": "evaluation/material/sop-chemie-ohne-aussenfreisetzung.md",
      "rolle": "material",
      "hinweis": "Vollständig erfundene Übungsnachrichten; Rollen und Zeitstände stehen im Text."
    }
  ],
  "erwartungen": {
    "muss": [
      "B07 aufgrund industriellen Ereignisses und überörtlichen Rettungsbedarfs prüfen.",
      "Acht bestätigte Verletzte von unbekannter Außenwirkung trennen.",
      "Anforderung nicht als eingesetzte externe Hilfe werten.",
      "Alle urteilsprägenden Aussagen sind auf tatsächlich vorliegendes Übungsmaterial zurückführbar; offene Achsen werden begründet."
    ],
    "darf_nicht": [
      "B07 allein wegen fehlender bestätigter Außenfreisetzung ausschließen.",
      "Eine Giftwolke oder eingetroffene überörtliche Kräfte behaupten.",
      "Eine aktuelle Webprüfung, fremde Quelleninhalte, reale Alarmierungen oder zusätzliche bestätigte Zahlen erfinden."
    ],
    "t0": "2026-10-21T12:00",
    "referenzraum": "Bund",
    "ereignisarten": [
      "Industrieunfall / Chemieunfall"
    ]
  }
}
