{
  "format": "ki-lead-evaluationsfall/1",
  "id": "sop-lebensmittel-versorgung",
  "titel": "Nahrung vorhanden, Bedarf besonderer Gruppen ungedeckt (FIKTIV)",
  "stand": "2026-10-21",
  "fiktiv": true,
  "auftrag": {
    "sachverhalt": "Nahrung vorhanden, Bedarf besonderer Gruppen ungedeckt",
    "stichworte": "B05, C14, C09",
    "stichtag": "2026-10-21",
    "meldezeitpunkt": "2026-10-21T12:00",
    "prueffrage": "Nur das beigefügte Übungsmaterial auswerten. Relevanz für den Bevölkerungsschutz in Deutschland, belegte Wirkungen und offene Fragen getrennt darstellen. Keine Live-Recherche und keine erfundenen Ergänzungen.",
    "websuche": false,
    "verdichtung": false
  },
  "material": [
    {
      "datei": "evaluation/material/sop-lebensmittel-versorgung.md",
      "rolle": "material",
      "hinweis": "Vollständig erfundene Übungsnachrichten; Rollen und Zeitstände stehen im Text."
    }
  ],
  "erwartungen": {
    "muss": [
      "Allgemeinen Bestand und konkret ungedeckten speziellen Versorgungsbedarf unterscheiden.",
      "Fehlende Spezialnahrung nicht zu einer allgemeinen Kontamination umdeuten.",
      "Alle urteilsprägenden Aussagen sind auf tatsächlich vorliegendes Übungsmaterial zurückführbar; offene Achsen werden begründet."
    ],
    "darf_nicht": [
      "Ausreichende allgemeine Lebensmittel als vollständige Bedarfsdeckung werten.",
      "Eine Ersatzlieferung als zugesagt darstellen.",
      "Eine aktuelle Webprüfung, fremde Quelleninhalte, reale Alarmierungen oder zusätzliche bestätigte Zahlen erfinden."
    ],
    "t0": "2026-10-21T12:00",
    "referenzraum": "Bund",
    "ereignisarten": [
      "Extremhitze / Dürre"
    ]
  }
}
